{"$schema":"https://json-schema.org/draft/2020-12/schema","title":"Product Input","type":"object","required":["product_name","brand_name_kr","category_main","description_raw","keywords","issues"],"properties":{"product_name":{"type":"string","minLength":1},"brand_name_kr":{"type":"string","minLength":1},"brand_name_en":{"type":["string","null"]},"category_main":{"type":"string","minLength":1},"category_sub":{"type":["string","null"]},"category_confidence":{"enum":["high","medium","low"]},"description_raw":{"type":"string","minLength":1},"keywords":{"type":"array","items":{"type":"string"}},"target_audience":{"type":["string","null"]},"issues":{"type":"array","items":{"type":"string"}},"images":{"type":"array","items":{"type":"object"}}}}
