{"product_name":"PK 반팔 티셔츠","brand_name_kr":"비버리힐스폴로클럽","brand_name_en":"Beverly Hills Polo Club","category_main":"의류","category_sub":"상의 > 반팔 카라 티셔츠","category_confidence":"high","description_raw":"시원하고 편안한 PK 반팔 티셔츠, 활동성, 착용감, 스탠다드핏, 출퇴근, 야외활동, 평상복","keywords":["PK 반팔","스탠다드핏","카라 티셔츠","착용감","출퇴근","야외활동"],"target_audience":"일상과 출퇴근 겸용 기본 반팔을 찾는 고객(추정)","issues":["실제 이미지 누락","혼용률, 색상, 실측 치수, 제조국, 세탁라벨 미확인"]}
